2026-01-10 19:17:55,195 - INFO - ============================================================
2026-01-10 19:17:55,195 - INFO - Starting Analyst Estimates Ingestion
2026-01-10 19:17:55,195 - INFO - ============================================================
2026-01-10 19:17:55,386 - INFO - Found 159 tickers to process
2026-01-10 19:17:55,386 - INFO - Processing 20MICRONS.NS...
2026-01-10 19:17:58,944 - WARNING - No analyst data available for 20MICRONS.NS
2026-01-10 19:17:59,447 - INFO - Processing 21STCENMGM.NS...
2026-01-10 19:18:00,087 - WARNING - No analyst data available for 21STCENMGM.NS
2026-01-10 19:18:00,609 - INFO - Processing 360ONE.NS...
2026-01-10 19:18:02,638 - INFO - Processing 3IINFOLTD.NS...
2026-01-10 19:18:04,099 - WARNING - No analyst data available for 3IINFOLTD.NS
2026-01-10 19:18:04,602 - INFO - Processing 3MINDIA.NS...
2026-01-10 19:18:06,722 - INFO - Processing 3PLAND.NS...
2026-01-10 19:18:08,811 - ERROR - HTTP Error 404: {"quoteSummary":{"result":null,"error":{"code":"Not Found","description":"No fundamentals data found for symbol: 3PLAND.NS"}}}
2026-01-10 19:18:08,814 - WARNING - No analyst data available for 3PLAND.NS
2026-01-10 19:18:09,316 - INFO - Processing 5PAISA.NS...
2026-01-10 19:18:11,132 - INFO - Processing 63MOONS.NS...
2026-01-10 19:18:12,669 - WARNING - No analyst data available for 63MOONS.NS
2026-01-10 19:18:13,172 - INFO - Processing A2ZINFRA.NS...
2026-01-10 19:18:14,237 - WARNING - No analyst data available for A2ZINFRA.NS
2026-01-10 19:18:14,742 - INFO - Processing AAATECH.NS...
2026-01-10 19:18:17,068 - WARNING - No analyst data available for AAATECH.NS
2026-01-10 19:18:17,576 - INFO - Processing AADHARHFC.NS...
2026-01-10 19:18:18,967 - INFO - Processing AAKASH.NS...
2026-01-10 19:18:20,791 - WARNING - No analyst data available for AAKASH.NS
2026-01-10 19:18:21,294 - INFO - Processing AAPL...
2026-01-10 19:18:25,274 - INFO - Processing AAREYDRUGS.NS...
2026-01-10 19:18:25,910 - WARNING - No analyst data available for AAREYDRUGS.NS
2026-01-10 19:18:26,414 - INFO - Processing AARON.NS...
2026-01-10 19:18:27,725 - WARNING - No analyst data available for AARON.NS
2026-01-10 19:18:28,229 - INFO - Processing AARTECH.NS...
2026-01-10 19:18:32,730 - WARNING - No analyst data available for AARTECH.NS
2026-01-10 19:18:33,247 - INFO - Processing AARTIDRUGS.NS...
2026-01-10 19:18:34,991 - INFO - Processing AARTIIND.NS...
2026-01-10 19:18:36,018 - INFO - Processing AARTIPHARM.NS...
2026-01-10 19:18:36,944 - WARNING - No analyst data available for AARTIPHARM.NS
2026-01-10 19:18:37,458 - INFO - Processing AARTISURF.NS...
2026-01-10 19:18:38,572 - WARNING - No analyst data available for AARTISURF.NS
2026-01-10 19:18:39,075 - INFO - Progress: 20/159 tickers (12.6%)
2026-01-10 19:18:39,075 - INFO - Processing AARVI.NS...
2026-01-10 19:18:39,575 - WARNING - No analyst data available for AARVI.NS
2026-01-10 19:18:40,079 - INFO - Processing AAVAS.NS...
2026-01-10 19:18:42,593 - INFO - Processing ABAN.NS...
2026-01-10 19:18:43,885 - INFO - Processing ABB.NS...
2026-01-10 19:18:44,643 - ERROR - Error inserting estimate for 360ONE.NS: there is no unique or exclusion constraint matching the ON CONFLICT specification

2026-01-10 19:18:44,644 - ERROR - Error inserting estimate for 3MINDIA.NS: there is no unique or exclusion constraint matching the ON CONFLICT specification

2026-01-10 19:18:44,644 - ERROR - Error inserting estimate for 5PAISA.NS: 'strong_buy_count'
2026-01-10 19:18:44,644 - ERROR - Error inserting estimate for AADHARHFC.NS: there is no unique or exclusion constraint matching the ON CONFLICT specification

2026-01-10 19:18:44,644 - ERROR - Error inserting estimate for AAPL: there is no unique or exclusion constraint matching the ON CONFLICT specification

2026-01-10 19:18:44,656 - ERROR - Error inserting estimate for AARTIDRUGS.NS: there is no unique or exclusion constraint matching the ON CONFLICT specification

2026-01-10 19:18:44,659 - ERROR - Error inserting estimate for AARTIIND.NS: there is no unique or exclusion constraint matching the ON CONFLICT specification

2026-01-10 19:18:44,659 - ERROR - Error inserting estimate for AAVAS.NS: there is no unique or exclusion constraint matching the ON CONFLICT specification

2026-01-10 19:18:44,664 - ERROR - Error inserting estimate for ABAN.NS: 'strong_buy_count'
2026-01-10 19:18:44,664 - ERROR - Error inserting estimate for ABB.NS: there is no unique or exclusion constraint matching the ON CONFLICT specification

2026-01-10 19:18:44,664 - INFO - Inserted batch of 0 estimates
2026-01-10 19:18:45,171 - INFO - Processing ABBOTINDIA.NS...
2026-01-10 19:18:46,962 - INFO - Processing ABCAPITAL.NS...
2026-01-10 19:18:48,806 - INFO - Processing ABCOTS.NS...
2026-01-10 19:18:52,568 - WARNING - No analyst data available for ABCOTS.NS
2026-01-10 19:18:53,070 - INFO - Processing ABDL.NS...
2026-01-10 19:18:55,087 - INFO - Processing ABFRL.NS...
2026-01-10 19:18:56,733 - INFO - Processing ABINFRA.NS...
2026-01-10 19:18:58,034 - WARNING - No analyst data available for ABINFRA.NS
2026-01-10 19:18:58,538 - INFO - Processing ABLBL.NS...
2026-01-10 19:18:59,618 - INFO - Processing ABMINTLLTD.NS...
2026-01-10 19:19:01,746 - WARNING - No analyst data available for ABMINTLLTD.NS
2026-01-10 19:19:02,256 - INFO - Processing ABREL.NS...
2026-01-10 19:19:05,134 - INFO - Processing ABSLAMC.NS...
2026-01-10 19:19:06,941 - INFO - Processing ACC.NS...
2026-01-10 19:19:08,081 - INFO - Processing ACCELYA.NS...
2026-01-10 19:19:09,567 - INFO - Processing ACCURACY.NS...
2026-01-10 19:19:10,143 - WARNING - No analyst data available for ACCURACY.NS
2026-01-10 19:19:10,648 - INFO - Processing ACE.NS...
2026-01-10 19:19:11,099 - ERROR - Error inserting estimate for ABBOTINDIA.NS: there is no unique or exclusion constraint matching the ON CONFLICT specification

2026-01-10 19:19:11,115 - ERROR - Error inserting estimate for ABCAPITAL.NS: there is no unique or exclusion constraint matching the ON CONFLICT specification

2026-01-10 19:19:11,115 - ERROR - Error inserting estimate for ABDL.NS: there is no unique or exclusion constraint matching the ON CONFLICT specification

2026-01-10 19:19:11,115 - ERROR - Error inserting estimate for ABFRL.NS: there is no unique or exclusion constraint matching the ON CONFLICT specification

2026-01-10 19:19:11,115 - ERROR - Error inserting estimate for ABLBL.NS: there is no unique or exclusion constraint matching the ON CONFLICT specification

2026-01-10 19:19:11,131 - ERROR - Error inserting estimate for ABREL.NS: there is no unique or exclusion constraint matching the ON CONFLICT specification

2026-01-10 19:19:11,142 - ERROR - Error inserting estimate for ABSLAMC.NS: there is no unique or exclusion constraint matching the ON CONFLICT specification

2026-01-10 19:19:11,142 - ERROR - Error inserting estimate for ACC.NS: there is no unique or exclusion constraint matching the ON CONFLICT specification

2026-01-10 19:19:11,147 - ERROR - Error inserting estimate for ACCELYA.NS: 'strong_buy_count'
2026-01-10 19:19:11,147 - ERROR - Error inserting estimate for ACE.NS: 'strong_buy_count'
2026-01-10 19:19:11,147 - INFO - Inserted batch of 0 estimates
2026-01-10 19:19:11,652 - INFO - Processing ACEINTEG.NS...
2026-01-10 19:19:13,698 - WARNING - No analyst data available for ACEINTEG.NS
2026-01-10 19:19:14,203 - INFO - Processing ACI.NS...
2026-01-10 19:19:18,123 - INFO - Progress: 40/159 tickers (25.2%)
2026-01-10 19:19:18,123 - INFO - Processing ACL.NS...
2026-01-10 19:19:19,369 - WARNING - No analyst data available for ACL.NS
2026-01-10 19:19:19,878 - INFO - Processing ACMESOLAR.NS...
2026-01-10 19:19:21,502 - INFO - Processing ACUTAAS.NS...
2026-01-10 19:19:22,440 - INFO - Processing ADANIENSOL.NS...
2026-01-10 19:19:24,772 - INFO - Processing ADANIENT.NS...
2026-01-10 19:19:25,785 - INFO - Processing ADANIGREEN.NS...
2026-01-10 19:19:27,279 - INFO - Processing ADANIPORTS.NS...
2026-01-10 19:19:28,726 - INFO - Processing ADANIPOWER.NS...
2026-01-10 19:19:30,684 - INFO - Processing ADFFOODS.NS...
2026-01-10 19:19:32,234 - INFO - Processing ADL.NS...
2026-01-10 19:19:33,054 - WARNING - No analyst data available for ADL.NS
2026-01-10 19:19:33,557 - INFO - Processing ADOR.NS...
2026-01-10 19:19:36,124 - ERROR - Error inserting estimate for ACI.NS: there is no unique or exclusion constraint matching the ON CONFLICT specification

2026-01-10 19:19:36,132 - ERROR - Error inserting estimate for ACMESOLAR.NS: there is no unique or exclusion constraint matching the ON CONFLICT specification

2026-01-10 19:19:36,132 - ERROR - Error inserting estimate for ACUTAAS.NS: there is no unique or exclusion constraint matching the ON CONFLICT specification

2026-01-10 19:19:36,132 - ERROR - Error inserting estimate for ADANIENSOL.NS: there is no unique or exclusion constraint matching the ON CONFLICT specification

2026-01-10 19:19:36,132 - ERROR - Error inserting estimate for ADANIENT.NS: there is no unique or exclusion constraint matching the ON CONFLICT specification

2026-01-10 19:19:36,148 - ERROR - Error inserting estimate for ADANIGREEN.NS: there is no unique or exclusion constraint matching the ON CONFLICT specification

2026-01-10 19:19:36,148 - ERROR - Error inserting estimate for ADANIPORTS.NS: there is no unique or exclusion constraint matching the ON CONFLICT specification

2026-01-10 19:19:36,148 - ERROR - Error inserting estimate for ADANIPOWER.NS: there is no unique or exclusion constraint matching the ON CONFLICT specification

2026-01-10 19:19:36,164 - ERROR - Error inserting estimate for ADFFOODS.NS: there is no unique or exclusion constraint matching the ON CONFLICT specification

2026-01-10 19:19:36,167 - ERROR - Error inserting estimate for ADOR.NS: there is no unique or exclusion constraint matching the ON CONFLICT specification

2026-01-10 19:19:36,167 - INFO - Inserted batch of 0 estimates
2026-01-10 19:19:36,671 - INFO - Processing AKZOINDIA.NS...
2026-01-10 19:19:37,988 - INFO - Processing ALKEM.NS...
2026-01-10 19:19:41,030 - INFO - Processing AMBUJACEM.NS...
2026-01-10 19:19:42,880 - INFO - Processing APOLLOTYRE.NS...
2026-01-10 19:19:44,512 - INFO - Processing ASHOKLEY.NS...
2026-01-10 19:19:46,482 - INFO - Processing ASIANPAINT.NS...
2026-01-10 19:19:49,123 - INFO - Processing AUROPHARMA.NS...
2026-01-10 19:19:50,993 - INFO - Processing AXISBANK.NS...
2026-01-10 19:19:53,398 - INFO - Processing BAJAJ-AUTO.NS...
2026-01-10 19:19:54,383 - INFO - Progress: 60/159 tickers (37.7%)
2026-01-10 19:19:54,383 - INFO - Processing BAJAJFINSV.NS...
2026-01-10 19:19:55,291 - ERROR - Error inserting estimate for AKZOINDIA.NS: there is no unique or exclusion constraint matching the ON CONFLICT specification

2026-01-10 19:19:55,295 - ERROR - Error inserting estimate for ALKEM.NS: there is no unique or exclusion constraint matching the ON CONFLICT specification

2026-01-10 19:19:55,303 - ERROR - Error inserting estimate for AMBUJACEM.NS: there is no unique or exclusion constraint matching the ON CONFLICT specification

2026-01-10 19:19:55,311 - ERROR - Error inserting estimate for APOLLOTYRE.NS: there is no unique or exclusion constraint matching the ON CONFLICT specification

2026-01-10 19:19:55,317 - ERROR - Error inserting estimate for ASHOKLEY.NS: there is no unique or exclusion constraint matching the ON CONFLICT specification

2026-01-10 19:19:55,323 - ERROR - Error inserting estimate for ASIANPAINT.NS: there is no unique or exclusion constraint matching the ON CONFLICT specification

2026-01-10 19:19:55,331 - ERROR - Error inserting estimate for AUROPHARMA.NS: there is no unique or exclusion constraint matching the ON CONFLICT specification

2026-01-10 19:19:55,338 - ERROR - Error inserting estimate for AXISBANK.NS: there is no unique or exclusion constraint matching the ON CONFLICT specification

2026-01-10 19:19:55,345 - ERROR - Error inserting estimate for BAJAJ-AUTO.NS: there is no unique or exclusion constraint matching the ON CONFLICT specification

2026-01-10 19:19:55,351 - ERROR - Error inserting estimate for BAJAJFINSV.NS: there is no unique or exclusion constraint matching the ON CONFLICT specification

2026-01-10 19:19:55,357 - INFO - Inserted batch of 0 estimates
2026-01-10 19:19:55,859 - INFO - Processing BAJFINANCE.NS...
2026-01-10 19:19:57,156 - INFO - Processing BANDHANBNK.NS...
2026-01-10 19:20:00,804 - INFO - Processing BHARTIARTL.NS...
2026-01-10 19:20:02,636 - INFO - Processing BIOCON.NS...
2026-01-10 19:20:04,903 - INFO - Processing BPCL.NS...
2026-01-10 19:20:06,841 - INFO - Processing BRITANNIA.NS...
2026-01-10 19:20:08,269 - INFO - Processing CADILAHC.NS...
2026-01-10 19:20:10,458 - ERROR - HTTP Error 404: {"quoteSummary":{"result":null,"error":{"code":"Not Found","description":"Quote not found for symbol: CADILAHC.NS"}}}
2026-01-10 19:20:10,458 - WARNING - No analyst data available for CADILAHC.NS
2026-01-10 19:20:10,967 - INFO - Processing CHOLAFIN.NS...
2026-01-10 19:20:12,386 - INFO - Processing CIPLA.NS...
2026-01-10 19:20:14,132 - INFO - Processing COALINDIA.NS...
2026-01-10 19:20:15,157 - INFO - Processing COFORGE.NS...
2026-01-10 19:20:16,003 - ERROR - Error inserting estimate for BAJFINANCE.NS: there is no unique or exclusion constraint matching the ON CONFLICT specification

2026-01-10 19:20:16,003 - ERROR - Error inserting estimate for BANDHANBNK.NS: there is no unique or exclusion constraint matching the ON CONFLICT specification

2026-01-10 19:20:16,017 - ERROR - Error inserting estimate for BHARTIARTL.NS: there is no unique or exclusion constraint matching the ON CONFLICT specification

2026-01-10 19:20:16,019 - ERROR - Error inserting estimate for BIOCON.NS: there is no unique or exclusion constraint matching the ON CONFLICT specification

2026-01-10 19:20:16,019 - ERROR - Error inserting estimate for BPCL.NS: there is no unique or exclusion constraint matching the ON CONFLICT specification

2026-01-10 19:20:16,019 - ERROR - Error inserting estimate for BRITANNIA.NS: there is no unique or exclusion constraint matching the ON CONFLICT specification

2026-01-10 19:20:16,034 - ERROR - Error inserting estimate for CHOLAFIN.NS: there is no unique or exclusion constraint matching the ON CONFLICT specification

2026-01-10 19:20:16,034 - ERROR - Error inserting estimate for CIPLA.NS: there is no unique or exclusion constraint matching the ON CONFLICT specification

2026-01-10 19:20:16,041 - ERROR - Error inserting estimate for COALINDIA.NS: there is no unique or exclusion constraint matching the ON CONFLICT specification

2026-01-10 19:20:16,041 - ERROR - Error inserting estimate for COFORGE.NS: there is no unique or exclusion constraint matching the ON CONFLICT specification

2026-01-10 19:20:16,041 - INFO - Inserted batch of 0 estimates
2026-01-10 19:20:16,549 - INFO - Processing COLPAL.NS...
2026-01-10 19:20:17,690 - INFO - Processing CROMPTON.NS...
2026-01-10 19:20:20,863 - INFO - Processing DABUR.NS...
2026-01-10 19:20:22,954 - INFO - Processing DISHTV.NS...
2026-01-10 19:20:24,633 - INFO - Processing DIVISLAB.NS...
2026-01-10 19:20:26,496 - INFO - Processing DMART.NS...
2026-01-10 19:20:28,441 - INFO - Processing DRREDDY.NS...
2026-01-10 19:20:30,253 - INFO - Processing EICHERMOT.NS...
2026-01-10 19:20:31,211 - INFO - Progress: 80/159 tickers (50.3%)
2026-01-10 19:20:31,211 - INFO - Processing EMAMILTD.NS...
2026-01-10 19:20:33,274 - INFO - Processing FEDERALBNK.NS...
2026-01-10 19:20:35,328 - ERROR - Error inserting estimate for COLPAL.NS: there is no unique or exclusion constraint matching the ON CONFLICT specification

2026-01-10 19:20:35,328 - ERROR - Error inserting estimate for CROMPTON.NS: there is no unique or exclusion constraint matching the ON CONFLICT specification

2026-01-10 19:20:35,328 - ERROR - Error inserting estimate for DABUR.NS: there is no unique or exclusion constraint matching the ON CONFLICT specification

2026-01-10 19:20:35,346 - ERROR - Error inserting estimate for DISHTV.NS: there is no unique or exclusion constraint matching the ON CONFLICT specification

2026-01-10 19:20:35,346 - ERROR - Error inserting estimate for DIVISLAB.NS: there is no unique or exclusion constraint matching the ON CONFLICT specification

2026-01-10 19:20:35,346 - ERROR - Error inserting estimate for DMART.NS: there is no unique or exclusion constraint matching the ON CONFLICT specification

2026-01-10 19:20:35,346 - ERROR - Error inserting estimate for DRREDDY.NS: there is no unique or exclusion constraint matching the ON CONFLICT specification

2026-01-10 19:20:35,360 - ERROR - Error inserting estimate for EICHERMOT.NS: there is no unique or exclusion constraint matching the ON CONFLICT specification

2026-01-10 19:20:35,368 - ERROR - Error inserting estimate for EMAMILTD.NS: there is no unique or exclusion constraint matching the ON CONFLICT specification

2026-01-10 19:20:35,368 - ERROR - Error inserting estimate for FEDERALBNK.NS: there is no unique or exclusion constraint matching the ON CONFLICT specification

2026-01-10 19:20:35,368 - INFO - Inserted batch of 0 estimates
2026-01-10 19:20:35,875 - INFO - Processing GODREJCP.NS...
2026-01-10 19:20:38,593 - INFO - Processing GOOGL...
2026-01-10 19:20:40,331 - INFO - Processing GRASIM.NS...
2026-01-10 19:20:42,088 - INFO - Processing HAVELLS.NS...
2026-01-10 19:20:43,592 - INFO - Processing HCLTECH.NS...
2026-01-10 19:20:45,055 - INFO - Processing HDFCAMC.NS...
2026-01-10 19:20:46,692 - INFO - Processing HDFCBANK.NS...
2026-01-10 19:20:48,112 - INFO - Processing HDFCLIFE.NS...
2026-01-10 19:20:50,172 - INFO - Processing HEROMOTOCO.NS...
2026-01-10 19:20:52,225 - INFO - Processing HINDALCO.NS...
2026-01-10 19:20:55,083 - ERROR - Error inserting estimate for GODREJCP.NS: there is no unique or exclusion constraint matching the ON CONFLICT specification

2026-01-10 19:20:55,099 - ERROR - Error inserting estimate for GOOGL: there is no unique or exclusion constraint matching the ON CONFLICT specification

2026-01-10 19:20:55,104 - ERROR - Error inserting estimate for GRASIM.NS: there is no unique or exclusion constraint matching the ON CONFLICT specification

2026-01-10 19:20:55,107 - ERROR - Error inserting estimate for HAVELLS.NS: there is no unique or exclusion constraint matching the ON CONFLICT specification

2026-01-10 19:20:55,114 - ERROR - Error inserting estimate for HCLTECH.NS: there is no unique or exclusion constraint matching the ON CONFLICT specification

2026-01-10 19:20:55,119 - ERROR - Error inserting estimate for HDFCAMC.NS: there is no unique or exclusion constraint matching the ON CONFLICT specification

2026-01-10 19:20:55,124 - ERROR - Error inserting estimate for HDFCBANK.NS: there is no unique or exclusion constraint matching the ON CONFLICT specification

2026-01-10 19:20:55,124 - ERROR - Error inserting estimate for HDFCLIFE.NS: there is no unique or exclusion constraint matching the ON CONFLICT specification

2026-01-10 19:20:55,136 - ERROR - Error inserting estimate for HEROMOTOCO.NS: there is no unique or exclusion constraint matching the ON CONFLICT specification

2026-01-10 19:20:55,140 - ERROR - Error inserting estimate for HINDALCO.NS: there is no unique or exclusion constraint matching the ON CONFLICT specification

2026-01-10 19:20:55,142 - INFO - Inserted batch of 0 estimates
2026-01-10 19:20:55,644 - INFO - Processing HINDUNILVR.NS...
2026-01-10 19:20:57,521 - INFO - Processing HINDZINC.NS...
2026-01-10 19:20:59,570 - INFO - Processing IBM...
2026-01-10 19:21:01,242 - INFO - Processing ICICIBANK.NS...
2026-01-10 19:21:04,092 - INFO - Processing ICICIPRULI.NS...
2026-01-10 19:21:05,216 - INFO - Processing IDEA.NS...
2026-01-10 19:21:12,883 - INFO - Processing IDFCFIRSTB.NS...
2026-01-10 19:21:13,929 - INFO - Processing INDUSINDBK.NS...
2026-01-10 19:21:15,874 - INFO - Progress: 100/159 tickers (62.9%)
2026-01-10 19:21:15,874 - INFO - Processing INFY.NS...
2026-01-10 19:21:22,207 - INFO - Processing IOC.NS...
2026-01-10 19:21:23,446 - ERROR - Error inserting estimate for HINDUNILVR.NS: there is no unique or exclusion constraint matching the ON CONFLICT specification

2026-01-10 19:21:23,446 - ERROR - Error inserting estimate for HINDZINC.NS: there is no unique or exclusion constraint matching the ON CONFLICT specification

2026-01-10 19:21:23,446 - ERROR - Error inserting estimate for IBM: there is no unique or exclusion constraint matching the ON CONFLICT specification

2026-01-10 19:21:23,459 - ERROR - Error inserting estimate for ICICIBANK.NS: there is no unique or exclusion constraint matching the ON CONFLICT specification

2026-01-10 19:21:23,463 - ERROR - Error inserting estimate for ICICIPRULI.NS: there is no unique or exclusion constraint matching the ON CONFLICT specification

2026-01-10 19:21:23,467 - ERROR - Error inserting estimate for IDEA.NS: there is no unique or exclusion constraint matching the ON CONFLICT specification

2026-01-10 19:21:23,470 - ERROR - Error inserting estimate for IDFCFIRSTB.NS: there is no unique or exclusion constraint matching the ON CONFLICT specification

2026-01-10 19:21:23,470 - ERROR - Error inserting estimate for INDUSINDBK.NS: there is no unique or exclusion constraint matching the ON CONFLICT specification

2026-01-10 19:21:23,478 - ERROR - Error inserting estimate for INFY.NS: there is no unique or exclusion constraint matching the ON CONFLICT specification

2026-01-10 19:21:23,478 - ERROR - Error inserting estimate for IOC.NS: there is no unique or exclusion constraint matching the ON CONFLICT specification

2026-01-10 19:21:23,486 - INFO - Inserted batch of 0 estimates
2026-01-10 19:21:23,988 - INFO - Processing ITC.NS...
2026-01-10 19:21:25,325 - INFO - Processing JINDALSTEL.NS...
2026-01-10 19:21:26,505 - INFO - Processing JKCEMENT.NS...
2026-01-10 19:21:28,893 - INFO - Processing JSWSTEEL.NS...
2026-01-10 19:21:31,354 - INFO - Processing JUBLFOOD.NS...
2026-01-10 19:21:34,692 - INFO - Processing KANSAINER.NS...
2026-01-10 19:21:38,175 - INFO - Processing KOTAKBANK.NS...
2026-01-10 19:21:39,877 - INFO - Processing L&TFH.NS...
2026-01-10 19:21:41,679 - ERROR - HTTP Error 404: {"quoteSummary":{"result":null,"error":{"code":"Not Found","description":"Quote not found for symbol: L&TFH.NS"}}}
2026-01-10 19:21:41,691 - WARNING - No analyst data available for L&TFH.NS
2026-01-10 19:21:42,195 - INFO - Processing LT.NS...
2026-01-10 19:21:44,037 - INFO - Processing LTIM.NS...
2026-01-10 19:21:47,321 - INFO - Processing LTTS.NS...
2026-01-10 19:21:49,165 - ERROR - Error inserting estimate for ITC.NS: there is no unique or exclusion constraint matching the ON CONFLICT specification

2026-01-10 19:21:49,172 - ERROR - Error inserting estimate for JINDALSTEL.NS: there is no unique or exclusion constraint matching the ON CONFLICT specification

2026-01-10 19:21:49,172 - ERROR - Error inserting estimate for JKCEMENT.NS: there is no unique or exclusion constraint matching the ON CONFLICT specification

2026-01-10 19:21:49,172 - ERROR - Error inserting estimate for JSWSTEEL.NS: there is no unique or exclusion constraint matching the ON CONFLICT specification

2026-01-10 19:21:49,172 - ERROR - Error inserting estimate for JUBLFOOD.NS: there is no unique or exclusion constraint matching the ON CONFLICT specification

2026-01-10 19:21:49,190 - ERROR - Error inserting estimate for KANSAINER.NS: there is no unique or exclusion constraint matching the ON CONFLICT specification

2026-01-10 19:21:49,190 - ERROR - Error inserting estimate for KOTAKBANK.NS: there is no unique or exclusion constraint matching the ON CONFLICT specification

2026-01-10 19:21:49,190 - ERROR - Error inserting estimate for LT.NS: there is no unique or exclusion constraint matching the ON CONFLICT specification

2026-01-10 19:21:49,190 - ERROR - Error inserting estimate for LTIM.NS: there is no unique or exclusion constraint matching the ON CONFLICT specification

2026-01-10 19:21:49,207 - ERROR - Error inserting estimate for LTTS.NS: there is no unique or exclusion constraint matching the ON CONFLICT specification

2026-01-10 19:21:49,207 - INFO - Inserted batch of 0 estimates
2026-01-10 19:21:49,711 - INFO - Processing LUPIN.NS...
2026-01-10 19:21:53,251 - INFO - Processing M&M.NS...
2026-01-10 19:21:54,890 - INFO - Processing MARICO.NS...
2026-01-10 19:21:56,316 - INFO - Processing MARUTI.NS...
2026-01-10 19:21:59,679 - INFO - Processing MPHASIS.NS...
2026-01-10 19:22:01,113 - INFO - Processing MRF.NS...
2026-01-10 19:22:02,982 - INFO - Processing MSFT...
2026-01-10 19:22:04,851 - INFO - Progress: 120/159 tickers (75.5%)
2026-01-10 19:22:04,851 - INFO - Processing MUTHOOTFIN.NS...
2026-01-10 19:22:06,457 - INFO - Processing NATIONALUM.NS...
2026-01-10 19:22:08,074 - INFO - Processing NESTLEIND.NS...
2026-01-10 19:22:09,423 - ERROR - Error inserting estimate for LUPIN.NS: there is no unique or exclusion constraint matching the ON CONFLICT specification

2026-01-10 19:22:09,426 - ERROR - Error inserting estimate for M&M.NS: there is no unique or exclusion constraint matching the ON CONFLICT specification

2026-01-10 19:22:09,431 - ERROR - Error inserting estimate for MARICO.NS: there is no unique or exclusion constraint matching the ON CONFLICT specification

2026-01-10 19:22:09,435 - ERROR - Error inserting estimate for MARUTI.NS: there is no unique or exclusion constraint matching the ON CONFLICT specification

2026-01-10 19:22:09,440 - ERROR - Error inserting estimate for MPHASIS.NS: there is no unique or exclusion constraint matching the ON CONFLICT specification

2026-01-10 19:22:09,443 - ERROR - Error inserting estimate for MRF.NS: there is no unique or exclusion constraint matching the ON CONFLICT specification

2026-01-10 19:22:09,443 - ERROR - Error inserting estimate for MSFT: there is no unique or exclusion constraint matching the ON CONFLICT specification

2026-01-10 19:22:09,451 - ERROR - Error inserting estimate for MUTHOOTFIN.NS: there is no unique or exclusion constraint matching the ON CONFLICT specification

2026-01-10 19:22:09,451 - ERROR - Error inserting estimate for NATIONALUM.NS: there is no unique or exclusion constraint matching the ON CONFLICT specification

2026-01-10 19:22:09,460 - ERROR - Error inserting estimate for NESTLEIND.NS: there is no unique or exclusion constraint matching the ON CONFLICT specification

2026-01-10 19:22:09,460 - INFO - Inserted batch of 0 estimates
2026-01-10 19:22:09,965 - INFO - Processing NMDC.NS...
2026-01-10 19:22:12,708 - INFO - Processing NTPC.NS...
2026-01-10 19:22:14,226 - INFO - Processing ONGC.NS...
2026-01-10 19:22:16,061 - INFO - Processing PERSISTENT.NS...
2026-01-10 19:22:18,008 - INFO - Processing PIDILITIND.NS...
2026-01-10 19:22:19,140 - INFO - Processing PNB.NS...
2026-01-10 19:22:30,316 - INFO - Processing PNBHOUSING.NS...
2026-01-10 19:22:41,985 - INFO - Processing POWERGRID.NS...
2026-01-10 19:22:43,932 - INFO - Processing PVRINOX.NS...
2026-01-10 19:22:47,089 - INFO - Processing RAMCOCEM.NS...
2026-01-10 19:22:47,981 - ERROR - Error inserting estimate for NMDC.NS: there is no unique or exclusion constraint matching the ON CONFLICT specification

2026-01-10 19:22:47,993 - ERROR - Error inserting estimate for NTPC.NS: there is no unique or exclusion constraint matching the ON CONFLICT specification

2026-01-10 19:22:47,998 - ERROR - Error inserting estimate for ONGC.NS: there is no unique or exclusion constraint matching the ON CONFLICT specification

2026-01-10 19:22:47,998 - ERROR - Error inserting estimate for PERSISTENT.NS: there is no unique or exclusion constraint matching the ON CONFLICT specification

2026-01-10 19:22:47,998 - ERROR - Error inserting estimate for PIDILITIND.NS: there is no unique or exclusion constraint matching the ON CONFLICT specification

2026-01-10 19:22:48,009 - ERROR - Error inserting estimate for PNB.NS: there is no unique or exclusion constraint matching the ON CONFLICT specification

2026-01-10 19:22:48,016 - ERROR - Error inserting estimate for PNBHOUSING.NS: there is no unique or exclusion constraint matching the ON CONFLICT specification

2026-01-10 19:22:48,016 - ERROR - Error inserting estimate for POWERGRID.NS: there is no unique or exclusion constraint matching the ON CONFLICT specification

2026-01-10 19:22:48,026 - ERROR - Error inserting estimate for PVRINOX.NS: there is no unique or exclusion constraint matching the ON CONFLICT specification

2026-01-10 19:22:48,031 - ERROR - Error inserting estimate for RAMCOCEM.NS: there is no unique or exclusion constraint matching the ON CONFLICT specification

2026-01-10 19:22:48,031 - INFO - Inserted batch of 0 estimates
2026-01-10 19:22:48,536 - INFO - Processing RELIANCE.NS...
2026-01-10 19:22:50,672 - INFO - Processing SAIL.NS...
2026-01-10 19:22:53,542 - INFO - Processing SBILIFE.NS...
2026-01-10 19:22:55,590 - INFO - Processing SBIN.NS...
2026-01-10 19:22:57,841 - INFO - Processing SHOPERSTOP.NS...
2026-01-10 19:23:00,914 - INFO - Processing SHREECEM.NS...
2026-01-10 19:23:02,661 - INFO - Processing SIEMENS.NS...
2026-01-10 19:23:06,750 - INFO - Progress: 140/159 tickers (88.1%)
2026-01-10 19:23:06,750 - INFO - Processing SUNPHARMA.NS...
2026-01-10 19:23:08,231 - INFO - Processing SUNTV.NS...
2026-01-10 19:23:10,073 - INFO - Processing TATACONSUM.NS...
2026-01-10 19:23:11,488 - ERROR - Error inserting estimate for RELIANCE.NS: there is no unique or exclusion constraint matching the ON CONFLICT specification

2026-01-10 19:23:11,488 - ERROR - Error inserting estimate for SAIL.NS: there is no unique or exclusion constraint matching the ON CONFLICT specification

2026-01-10 19:23:11,488 - ERROR - Error inserting estimate for SBILIFE.NS: there is no unique or exclusion constraint matching the ON CONFLICT specification

2026-01-10 19:23:11,496 - ERROR - Error inserting estimate for SBIN.NS: there is no unique or exclusion constraint matching the ON CONFLICT specification

2026-01-10 19:23:11,498 - ERROR - Error inserting estimate for SHOPERSTOP.NS: there is no unique or exclusion constraint matching the ON CONFLICT specification

2026-01-10 19:23:11,502 - ERROR - Error inserting estimate for SHREECEM.NS: there is no unique or exclusion constraint matching the ON CONFLICT specification

2026-01-10 19:23:11,505 - ERROR - Error inserting estimate for SIEMENS.NS: there is no unique or exclusion constraint matching the ON CONFLICT specification

2026-01-10 19:23:11,508 - ERROR - Error inserting estimate for SUNPHARMA.NS: there is no unique or exclusion constraint matching the ON CONFLICT specification

2026-01-10 19:23:11,511 - ERROR - Error inserting estimate for SUNTV.NS: there is no unique or exclusion constraint matching the ON CONFLICT specification

2026-01-10 19:23:11,512 - ERROR - Error inserting estimate for TATACONSUM.NS: there is no unique or exclusion constraint matching the ON CONFLICT specification

2026-01-10 19:23:11,512 - INFO - Inserted batch of 0 estimates
2026-01-10 19:23:12,016 - INFO - Processing TATAMOTORS.NS...
2026-01-10 19:23:14,038 - ERROR - HTTP Error 404: {"quoteSummary":{"result":null,"error":{"code":"Not Found","description":"Quote not found for symbol: TATAMOTORS.NS"}}}
2026-01-10 19:23:15,459 - ERROR - HTTP Error 404: {"quoteSummary":{"result":null,"error":{"code":"Not Found","description":"Quote not found for symbol: TATAMOTORS.NS"}}}
2026-01-10 19:23:15,459 - WARNING - No analyst data available for TATAMOTORS.NS
2026-01-10 19:23:15,965 - INFO - Processing TATAPOWER.NS...
2026-01-10 19:23:19,143 - INFO - Processing TATASTEEL.NS...
2026-01-10 19:23:20,140 - INFO - Processing TCS.NS...
2026-01-10 19:23:25,705 - INFO - Processing TECHM.NS...
2026-01-10 19:23:27,434 - INFO - Processing TITAN.NS...
2026-01-10 19:23:29,368 - INFO - Processing TORNTPHARM.NS...
2026-01-10 19:23:32,964 - INFO - Processing TRENT.NS...
2026-01-10 19:23:34,309 - INFO - Processing TSLA...
2026-01-10 19:23:35,589 - INFO - Processing TVSMOTOR.NS...
2026-01-10 19:23:36,565 - INFO - Processing ULTRACEMCO.NS...
2026-01-10 19:23:37,735 - ERROR - Error inserting estimate for TATAPOWER.NS: there is no unique or exclusion constraint matching the ON CONFLICT specification

2026-01-10 19:23:37,735 - ERROR - Error inserting estimate for TATASTEEL.NS: there is no unique or exclusion constraint matching the ON CONFLICT specification

2026-01-10 19:23:37,750 - ERROR - Error inserting estimate for TCS.NS: there is no unique or exclusion constraint matching the ON CONFLICT specification

2026-01-10 19:23:37,752 - ERROR - Error inserting estimate for TECHM.NS: there is no unique or exclusion constraint matching the ON CONFLICT specification

2026-01-10 19:23:37,752 - ERROR - Error inserting estimate for TITAN.NS: there is no unique or exclusion constraint matching the ON CONFLICT specification

2026-01-10 19:23:37,752 - ERROR - Error inserting estimate for TORNTPHARM.NS: there is no unique or exclusion constraint matching the ON CONFLICT specification

2026-01-10 19:23:37,767 - ERROR - Error inserting estimate for TRENT.NS: there is no unique or exclusion constraint matching the ON CONFLICT specification

2026-01-10 19:23:37,769 - ERROR - Error inserting estimate for TSLA: there is no unique or exclusion constraint matching the ON CONFLICT specification

2026-01-10 19:23:37,773 - ERROR - Error inserting estimate for TVSMOTOR.NS: there is no unique or exclusion constraint matching the ON CONFLICT specification

2026-01-10 19:23:37,773 - ERROR - Error inserting estimate for ULTRACEMCO.NS: there is no unique or exclusion constraint matching the ON CONFLICT specification

2026-01-10 19:23:37,782 - INFO - Inserted batch of 0 estimates
2026-01-10 19:23:38,284 - INFO - Processing VEDL.NS...
2026-01-10 19:23:40,104 - INFO - Processing VOLTAS.NS...
2026-01-10 19:23:46,131 - INFO - Processing WESTLIFE.NS...
2026-01-10 19:23:48,021 - INFO - Processing WIPRO.NS...
2026-01-10 19:23:49,285 - INFO - Processing ZEEL.NS...
2026-01-10 19:23:51,510 - ERROR - Error inserting estimate for VEDL.NS: there is no unique or exclusion constraint matching the ON CONFLICT specification

2026-01-10 19:23:51,510 - ERROR - Error inserting estimate for VOLTAS.NS: there is no unique or exclusion constraint matching the ON CONFLICT specification

2026-01-10 19:23:51,510 - ERROR - Error inserting estimate for WESTLIFE.NS: there is no unique or exclusion constraint matching the ON CONFLICT specification

2026-01-10 19:23:51,510 - ERROR - Error inserting estimate for WIPRO.NS: there is no unique or exclusion constraint matching the ON CONFLICT specification

2026-01-10 19:23:51,527 - ERROR - Error inserting estimate for ZEEL.NS: there is no unique or exclusion constraint matching the ON CONFLICT specification

2026-01-10 19:23:51,527 - INFO - Inserted final batch of 0 estimates
2026-01-10 19:23:51,527 - INFO - 
============================================================
2026-01-10 19:23:51,527 - INFO - Validating Data Quality
2026-01-10 19:23:51,527 - INFO - ============================================================
2026-01-10 19:23:51,560 - INFO - total_records: 0
2026-01-10 19:23:51,560 - INFO - records_with_targets: 0
2026-01-10 19:23:51,560 - INFO - records_with_estimates: 0
2026-01-10 19:23:51,563 - INFO - invalid_target_ranges: 0
2026-01-10 19:23:51,563 - INFO - records_with_analyst_count: 0
2026-01-10 19:23:51,565 - INFO - 
============================================================
2026-01-10 19:23:51,565 - INFO - Ingestion Summary
2026-01-10 19:23:51,567 - INFO - ============================================================
2026-01-10 19:23:51,567 - INFO - Total tickers processed: 159
2026-01-10 19:23:51,567 - INFO - Successfully fetched: 135
2026-01-10 19:23:51,567 - INFO - Failed/No data: 24
2026-01-10 19:23:51,572 - INFO - Time elapsed: 0:05:56.369910
2026-01-10 19:23:51,572 - INFO - ============================================================
