2026-01-10 19:23:55,018 - INFO - ============================================================
2026-01-10 19:23:55,019 - INFO - Starting Buyback Announcements Ingestion
2026-01-10 19:23:55,019 - INFO - ============================================================
2026-01-10 19:23:55,158 - INFO - Found 112 tickers to process
2026-01-10 19:23:55,158 - INFO - Processing AAPL...
2026-01-10 19:24:06,257 - INFO - Found 1 buyback(s) for AAPL
2026-01-10 19:24:06,559 - INFO - Processing ABB.NS...
2026-01-10 19:24:10,274 - INFO - Processing ABFRL.NS...
2026-01-10 19:24:11,955 - INFO - Processing ACC.NS...
2026-01-10 19:24:15,238 - INFO - Processing ADANIENT.NS...
2026-01-10 19:24:18,338 - INFO - Processing ADANIPOWER.NS...
2026-01-10 19:24:19,394 - INFO - Processing AKZOINDIA.NS...
2026-01-10 19:24:22,070 - INFO - Processing ALKEM.NS...
2026-01-10 19:24:24,270 - INFO - Processing AMBUJACEM.NS...
2026-01-10 19:24:26,183 - INFO - Processing APOLLOTYRE.NS...
2026-01-10 19:24:27,725 - INFO - Processing ASHOKLEY.NS...
2026-01-10 19:52:57,804 - ERROR - Error fetching buyback data for ASHOKLEY.NS: Failed to perform, curl: (28) Operation timed out after 1709694 milliseconds with 0 bytes received. See https://curl.se/libcurl/c/libcurl-errors.html first for more details.
2026-01-10 19:52:58,241 - INFO - Processing ASIANPAINT.NS...
2026-01-10 19:52:58,466 - ERROR - Error fetching buyback data for ASIANPAINT.NS: Failed to perform, curl: (6) Recv failure: Connection was reset. See https://curl.se/libcurl/c/libcurl-errors.html first for more details.
2026-01-10 19:52:58,775 - INFO - Processing AUROPHARMA.NS...
2026-01-10 19:52:58,780 - ERROR - Error fetching buyback data for AUROPHARMA.NS: Failed to perform, curl: (6) Could not resolve host: query2.finance.yahoo.com. See https://curl.se/libcurl/c/libcurl-errors.html first for more details.
2026-01-10 19:52:59,082 - INFO - Processing AXISBANK.NS...
2026-01-10 19:52:59,088 - ERROR - Error fetching buyback data for AXISBANK.NS: Failed to perform, curl: (6) Could not resolve host: query2.finance.yahoo.com. See https://curl.se/libcurl/c/libcurl-errors.html first for more details.
2026-01-10 19:52:59,389 - INFO - Processing BAJAJ-AUTO.NS...
2026-01-10 19:52:59,393 - ERROR - Error fetching buyback data for BAJAJ-AUTO.NS: Failed to perform, curl: (6) Could not resolve host: query2.finance.yahoo.com. See https://curl.se/libcurl/c/libcurl-errors.html first for more details.
2026-01-10 19:52:59,694 - INFO - Processing BAJAJFINSV.NS...
2026-01-10 19:52:59,698 - ERROR - Error fetching buyback data for BAJAJFINSV.NS: Failed to perform, curl: (6) Could not resolve host: query2.finance.yahoo.com. See https://curl.se/libcurl/c/libcurl-errors.html first for more details.
2026-01-10 19:53:00,001 - INFO - Processing BAJFINANCE.NS...
2026-01-10 19:53:00,005 - ERROR - Error fetching buyback data for BAJFINANCE.NS: Failed to perform, curl: (6) Could not resolve host: query2.finance.yahoo.com. See https://curl.se/libcurl/c/libcurl-errors.html first for more details.
2026-01-10 19:53:00,306 - INFO - Processing BANDHANBNK.NS...
2026-01-10 19:53:00,312 - ERROR - Error fetching buyback data for BANDHANBNK.NS: Failed to perform, curl: (6) Could not resolve host: query2.finance.yahoo.com. See https://curl.se/libcurl/c/libcurl-errors.html first for more details.
2026-01-10 19:53:00,613 - INFO - Processing BHARTIARTL.NS...
2026-01-10 19:53:00,618 - ERROR - Error fetching buyback data for BHARTIARTL.NS: Failed to perform, curl: (6) Could not resolve host: query2.finance.yahoo.com. See https://curl.se/libcurl/c/libcurl-errors.html first for more details.
2026-01-10 19:53:00,920 - INFO - Processing BIOCON.NS...
2026-01-10 19:53:00,926 - ERROR - Error fetching buyback data for BIOCON.NS: Failed to perform, curl: (6) Could not resolve host: query2.finance.yahoo.com. See https://curl.se/libcurl/c/libcurl-errors.html first for more details.
2026-01-10 19:53:00,926 - INFO - Progress: 20/112 tickers (17.9%)
2026-01-10 19:53:01,227 - INFO - Processing BPCL.NS...
2026-01-10 19:53:01,230 - ERROR - Error fetching buyback data for BPCL.NS: Failed to perform, curl: (6) Could not resolve host: query2.finance.yahoo.com. See https://curl.se/libcurl/c/libcurl-errors.html first for more details.
2026-01-10 19:53:01,533 - INFO - Processing BRITANNIA.NS...
2026-01-10 19:53:01,535 - ERROR - Error fetching buyback data for BRITANNIA.NS: Failed to perform, curl: (6) Could not resolve host: query2.finance.yahoo.com. See https://curl.se/libcurl/c/libcurl-errors.html first for more details.
2026-01-10 19:53:01,840 - INFO - Processing CHOLAFIN.NS...
2026-01-10 19:53:01,843 - ERROR - Error fetching buyback data for CHOLAFIN.NS: Failed to perform, curl: (6) Could not resolve host: query2.finance.yahoo.com. See https://curl.se/libcurl/c/libcurl-errors.html first for more details.
2026-01-10 19:53:03,521 - INFO - Processing CIPLA.NS...
2026-01-10 19:53:03,730 - ERROR - Error fetching buyback data for CIPLA.NS: Failed to perform, curl: (6) Could not resolve host: query2.finance.yahoo.com. See https://curl.se/libcurl/c/libcurl-errors.html first for more details.
2026-01-10 19:53:04,344 - INFO - Processing COALINDIA.NS...
2026-01-10 20:05:15,014 - INFO - Processing COFORGE.NS...
2026-01-10 20:05:26,190 - INFO - Processing COLPAL.NS...
2026-01-10 20:06:26,326 - INFO - Processing CROMPTON.NS...
2026-01-10 20:06:26,955 - ERROR - Error fetching buyback data for CROMPTON.NS: Failed to perform, curl: (6) Recv failure: Connection was reset. See https://curl.se/libcurl/c/libcurl-errors.html first for more details.
2026-01-10 20:06:27,294 - INFO - Processing DABUR.NS...
2026-01-10 20:06:50,505 - INFO - Processing DISHTV.NS...
2026-01-10 20:06:51,454 - INFO - Processing DIVISLAB.NS...
2026-01-10 20:06:55,393 - INFO - Processing DMART.NS...
2026-01-10 20:06:56,273 - INFO - Processing DRREDDY.NS...
2026-01-10 20:06:59,117 - INFO - Processing EICHERMOT.NS...
2026-01-10 20:07:00,202 - INFO - Processing EMAMILTD.NS...
2026-01-10 20:07:02,603 - INFO - Processing FEDERALBNK.NS...
2026-01-10 20:07:04,557 - INFO - Processing GODREJCP.NS...
2026-01-10 20:07:05,797 - INFO - Found 1 buyback(s) for GODREJCP.NS
2026-01-10 20:07:06,098 - INFO - Processing GOOGL...
2026-01-10 20:07:07,972 - INFO - Processing GRASIM.NS...
2026-01-10 20:07:10,402 - INFO - Found 1 buyback(s) for GRASIM.NS
2026-01-10 20:07:10,704 - INFO - Processing HAVELLS.NS...
2026-01-10 20:07:15,378 - INFO - Found 1 buyback(s) for HAVELLS.NS
2026-01-10 20:07:15,379 - INFO - Progress: 40/112 tickers (35.7%)
2026-01-10 20:07:15,680 - INFO - Processing HCLTECH.NS...
2026-01-10 20:07:17,589 - INFO - Processing HDFCAMC.NS...
2026-01-10 20:07:21,277 - INFO - Processing HDFCBANK.NS...
2026-01-10 20:07:22,861 - INFO - Found 1 buyback(s) for HDFCBANK.NS
2026-01-10 20:07:23,162 - INFO - Processing HDFCLIFE.NS...
2026-01-10 20:07:24,356 - INFO - Processing HEROMOTOCO.NS...
2026-01-10 20:07:27,112 - INFO - Processing HINDALCO.NS...
2026-01-10 20:07:34,249 - INFO - Processing HINDUNILVR.NS...
2026-01-10 20:07:36,184 - INFO - Processing HINDZINC.NS...
2026-01-10 20:07:38,096 - INFO - Processing IBM...
2026-01-10 20:07:40,500 - INFO - Processing ICICIBANK.NS...
2026-01-10 20:07:41,866 - INFO - Processing ICICIPRULI.NS...
2026-01-10 20:07:43,674 - INFO - Processing IDEA.NS...
2026-01-10 20:07:45,258 - INFO - Processing IDFCFIRSTB.NS...
2026-01-10 20:07:46,741 - INFO - Processing INDUSINDBK.NS...
2026-01-10 20:07:49,396 - INFO - Processing INFY.NS...
2026-01-10 20:07:52,002 - INFO - Processing IOC.NS...
2026-01-10 20:07:54,108 - INFO - Processing ITC.NS...
2026-01-10 20:07:56,305 - INFO - Processing JINDALSTEL.NS...
2026-01-10 20:07:57,737 - INFO - Processing JKCEMENT.NS...
2026-01-10 20:08:04,793 - INFO - Processing JSWSTEEL.NS...
2026-01-10 20:08:08,788 - INFO - Progress: 60/112 tickers (53.6%)
2026-01-10 20:08:09,089 - INFO - Processing JUBLFOOD.NS...
2026-01-10 20:08:11,187 - INFO - Processing KANSAINER.NS...
2026-01-10 20:08:13,175 - INFO - Processing KOTAKBANK.NS...
2026-01-10 20:08:15,597 - INFO - Processing LT.NS...
2026-01-10 20:08:17,890 - INFO - Processing LTIM.NS...
2026-01-10 20:08:19,606 - INFO - Processing LTTS.NS...
2026-01-10 20:08:21,214 - INFO - Processing LUPIN.NS...
2026-01-10 20:08:23,822 - INFO - Processing M&M.NS...
2026-01-10 20:08:25,902 - INFO - Processing MARICO.NS...
2026-01-10 20:08:28,086 - INFO - Processing MARUTI.NS...
2026-01-10 20:08:30,012 - INFO - Processing MPHASIS.NS...
2026-01-10 20:08:33,002 - INFO - Processing MRF.NS...
2026-01-10 20:08:34,614 - INFO - Processing MSFT...
2026-01-10 20:08:36,611 - INFO - Found 1 buyback(s) for MSFT
2026-01-10 20:08:36,915 - INFO - Processing MUTHOOTFIN.NS...
2026-01-10 20:08:38,065 - INFO - Processing NATIONALUM.NS...
2026-01-10 20:08:40,514 - INFO - Processing NESTLEIND.NS...
2026-01-10 20:08:42,980 - INFO - Processing NMDC.NS...
2026-01-10 20:08:43,991 - INFO - Found 1 buyback(s) for NMDC.NS
2026-01-10 20:08:44,294 - INFO - Processing NTPC.NS...
2026-01-10 20:08:46,505 - INFO - Processing ONGC.NS...
2026-01-10 20:08:48,436 - INFO - Processing PERSISTENT.NS...
2026-01-10 20:08:50,315 - INFO - Progress: 80/112 tickers (71.4%)
2026-01-10 20:08:50,617 - INFO - Processing PIDILITIND.NS...
2026-01-10 20:08:52,893 - INFO - Processing PNB.NS...
2026-01-10 20:08:55,497 - INFO - Processing PNBHOUSING.NS...
2026-01-10 20:08:57,246 - INFO - Processing POWERGRID.NS...
2026-01-10 20:08:59,847 - INFO - Processing PVRINOX.NS...
2026-01-10 20:09:02,660 - INFO - Processing RAMCOCEM.NS...
2026-01-10 20:09:04,585 - INFO - Processing RELIANCE.NS...
2026-01-10 20:09:06,986 - INFO - Processing SAIL.NS...
2026-01-10 20:09:12,698 - INFO - Processing SBILIFE.NS...
2026-01-10 20:09:14,054 - INFO - Processing SBIN.NS...
2026-01-10 20:09:18,012 - INFO - Processing SHOPERSTOP.NS...
2026-01-10 20:09:19,670 - INFO - Found 1 buyback(s) for SHOPERSTOP.NS
2026-01-10 20:09:19,985 - INFO - Processing SHREECEM.NS...
2026-01-10 20:09:22,479 - INFO - Processing SIEMENS.NS...
2026-01-10 20:09:23,954 - INFO - Found 1 buyback(s) for SIEMENS.NS
2026-01-10 20:09:24,256 - INFO - Processing SUNPHARMA.NS...
2026-01-10 20:09:25,946 - INFO - Found 1 buyback(s) for SUNPHARMA.NS
2026-01-10 20:09:26,253 - INFO - Processing SUNTV.NS...
2026-01-10 20:09:28,236 - INFO - Processing TATACONSUM.NS...
2026-01-10 20:09:30,383 - INFO - Processing TATAMOTORS.NS...
2026-01-10 20:09:31,017 - ERROR - HTTP Error 404: {"quoteSummary":{"result":null,"error":{"code":"Not Found","description":"Quote not found for symbol: TATAMOTORS.NS"}}}
2026-01-10 20:09:33,418 - ERROR - $TATAMOTORS.NS: possibly delisted; no price data found  (1d 1927-02-04 -> 2026-01-10) (Yahoo error = "No data found, symbol may be delisted")
2026-01-10 20:09:33,720 - INFO - Processing TATAPOWER.NS...
2026-01-10 20:09:35,357 - INFO - Found 1 buyback(s) for TATAPOWER.NS
2026-01-10 20:09:35,662 - INFO - Processing TATASTEEL.NS...
2026-01-10 20:09:38,049 - INFO - Processing TCS.NS...
2026-01-10 20:09:41,607 - INFO - Progress: 100/112 tickers (89.3%)
2026-01-10 20:09:41,918 - INFO - Processing TECHM.NS...
2026-01-10 20:09:44,832 - INFO - Processing TITAN.NS...
2026-01-10 20:09:49,043 - INFO - Processing TORNTPHARM.NS...
2026-01-10 20:09:51,401 - INFO - Processing TRENT.NS...
2026-01-10 20:09:53,465 - INFO - Processing TSLA...
2026-01-10 20:09:56,565 - INFO - Processing TVSMOTOR.NS...
2026-01-10 20:09:59,409 - INFO - Processing ULTRACEMCO.NS...
2026-01-10 20:10:02,321 - INFO - Processing VEDL.NS...
2026-01-10 20:10:04,345 - INFO - Processing VOLTAS.NS...
2026-01-10 20:10:06,359 - INFO - Processing WESTLIFE.NS...
2026-01-10 20:10:08,004 - INFO - Found 1 buyback(s) for WESTLIFE.NS
2026-01-10 20:10:08,305 - INFO - Processing WIPRO.NS...
2026-01-10 20:10:15,008 - INFO - Found 1 buyback(s) for WIPRO.NS
2026-01-10 20:10:15,310 - INFO - Processing ZEEL.NS...
2026-01-10 20:10:17,744 - ERROR - Error inserting buyback for AAPL: syntax error at or near "EXISTS"
LINE 15:     ON CONFLICT ON CONSTRAINT IF EXISTS unique_buyback_event
                                          ^

2026-01-10 20:10:17,744 - ERROR - Error inserting buyback for GODREJCP.NS: syntax error at or near "EXISTS"
LINE 15:     ON CONFLICT ON CONSTRAINT IF EXISTS unique_buyback_event
                                          ^

2026-01-10 20:10:17,744 - ERROR - Error inserting buyback for GRASIM.NS: syntax error at or near "EXISTS"
LINE 15:     ON CONFLICT ON CONSTRAINT IF EXISTS unique_buyback_event
                                          ^

2026-01-10 20:10:17,744 - ERROR - Error inserting buyback for HAVELLS.NS: syntax error at or near "EXISTS"
LINE 15:     ON CONFLICT ON CONSTRAINT IF EXISTS unique_buyback_event
                                          ^

2026-01-10 20:10:17,744 - ERROR - Error inserting buyback for HDFCBANK.NS: syntax error at or near "EXISTS"
LINE 15:     ON CONFLICT ON CONSTRAINT IF EXISTS unique_buyback_event
                                          ^

2026-01-10 20:10:17,749 - ERROR - Error inserting buyback for MSFT: syntax error at or near "EXISTS"
LINE 15:     ON CONFLICT ON CONSTRAINT IF EXISTS unique_buyback_event
                                          ^

2026-01-10 20:10:17,750 - ERROR - Error inserting buyback for NMDC.NS: syntax error at or near "EXISTS"
LINE 15:     ON CONFLICT ON CONSTRAINT IF EXISTS unique_buyback_event
                                          ^

2026-01-10 20:10:17,750 - ERROR - Error inserting buyback for SHOPERSTOP.NS: syntax error at or near "EXISTS"
LINE 15:     ON CONFLICT ON CONSTRAINT IF EXISTS unique_buyback_event
                                          ^

2026-01-10 20:10:17,750 - ERROR - Error inserting buyback for SIEMENS.NS: syntax error at or near "EXISTS"
LINE 15:     ON CONFLICT ON CONSTRAINT IF EXISTS unique_buyback_event
                                          ^

2026-01-10 20:10:17,750 - ERROR - Error inserting buyback for SUNPHARMA.NS: syntax error at or near "EXISTS"
LINE 15:     ON CONFLICT ON CONSTRAINT IF EXISTS unique_buyback_event
                                          ^

2026-01-10 20:10:17,750 - ERROR - Error inserting buyback for TATAPOWER.NS: syntax error at or near "EXISTS"
LINE 15:     ON CONFLICT ON CONSTRAINT IF EXISTS unique_buyback_event
                                          ^

2026-01-10 20:10:17,750 - ERROR - Error inserting buyback for WESTLIFE.NS: syntax error at or near "EXISTS"
LINE 15:     ON CONFLICT ON CONSTRAINT IF EXISTS unique_buyback_event
                                          ^

2026-01-10 20:10:17,750 - ERROR - Error inserting buyback for WIPRO.NS: syntax error at or near "EXISTS"
LINE 15:     ON CONFLICT ON CONSTRAINT IF EXISTS unique_buyback_event
                                          ^

2026-01-10 20:10:17,750 - INFO - Inserted 0 buyback announcements
2026-01-10 20:10:17,758 - INFO - Updated last_buyback_date for 0 companies
2026-01-10 20:10:17,758 - INFO - 
============================================================
2026-01-10 20:10:17,758 - INFO - Validating Data Quality
2026-01-10 20:10:17,758 - INFO - ============================================================
2026-01-10 20:10:17,758 - INFO - total_buybacks: 0
2026-01-10 20:10:17,758 - INFO - active_buybacks: 0
2026-01-10 20:10:17,758 - INFO - completed_buybacks: 0
2026-01-10 20:10:17,758 - INFO - buybacks_with_amount: 0
2026-01-10 20:10:17,758 - INFO - buybacks_with_dates: 0
2026-01-10 20:10:17,758 - INFO - invalid_price_ranges: 0
2026-01-10 20:10:17,758 - INFO - 
============================================================
2026-01-10 20:10:17,758 - INFO - Ingestion Summary
2026-01-10 20:10:17,758 - INFO - ============================================================
2026-01-10 20:10:17,758 - INFO - Total tickers processed: 112
2026-01-10 20:10:17,758 - INFO - Buyback records created: 13
2026-01-10 20:10:17,758 - INFO - Time elapsed: 0:46:22.739647
2026-01-10 20:10:17,758 - INFO - ============================================================
